{
  "session_id": "demo-001",
  "created_utc": "2026-02-24T11:00:00Z",
  "site": "demo",
  "system": {
    "name": "non-actionable-risk-display-feasibility",
    "version": "0.1.0"
  },
  "metrics": {
    "uptime_fraction": 0.98,
    "median_latency_ms": 420,
    "data_yield_fraction": 0.92,
    "ack_rate_fraction": 0.75,
    "notes": "Synthetic demo values for documentation/testing only."
  }
}
